{
  "SPDXID": "SPDXRef-DOCUMENT",
  "spdxVersion": "SPDX-2.3",
  "creationInfo": {
    "created": "2026-05-23T12:00:00Z",
    "creators": [
      "Tool: sentari-agent-1.2.3-test",
      "Device: golden-host"
    ]
  },
  "name": "sentari-sbom-golden-host",
  "dataLicense": "CC0-1.0",
  "documentNamespace": "https://sentari.io/sbom/00000000-0000-0000-0000-000000000000",
  "packages": [
    {
      "SPDXID": "SPDXRef-Package-0",
      "name": "acme-copilot",
      "versionInfo": "0.9.0",
      "downloadLocation": "NOASSERTION",
      "filesAnalyzed": false,
      "licenseConcluded": "NOASSERTION",
      "licenseDeclared": "NOASSERTION",
      "copyrightText": "NOASSERTION"
    },
    {
      "SPDXID": "SPDXRef-Package-1",
      "name": "libssl3",
      "versionInfo": "3.0.11-1",
      "downloadLocation": "NOASSERTION",
      "filesAnalyzed": false,
      "licenseConcluded": "NOASSERTION",
      "licenseDeclared": "NOASSERTION",
      "copyrightText": "NOASSERTION",
      "externalRefs": [
        {
          "referenceCategory": "PACKAGE-MANAGER",
          "referenceType": "purl",
          "referenceLocator": "pkg:deb/libssl3@3.0.11-1"
        }
      ]
    },
    {
      "SPDXID": "SPDXRef-Package-2",
      "name": "org.apache.commons:commons-lang3",
      "versionInfo": "3.14.0",
      "downloadLocation": "NOASSERTION",
      "filesAnalyzed": false,
      "licenseConcluded": "NOASSERTION",
      "licenseDeclared": "NOASSERTION",
      "copyrightText": "NOASSERTION",
      "externalRefs": [
        {
          "referenceCategory": "PACKAGE-MANAGER",
          "referenceType": "purl",
          "referenceLocator": "pkg:maven/org.apache.commons/commons-lang3@3.14.0"
        }
      ]
    },
    {
      "SPDXID": "SPDXRef-Package-3",
      "name": "@scope/pkg",
      "versionInfo": "1.0.0",
      "downloadLocation": "NOASSERTION",
      "filesAnalyzed": false,
      "licenseConcluded": "NOASSERTION",
      "licenseDeclared": "NOASSERTION",
      "copyrightText": "NOASSERTION",
      "externalRefs": [
        {
          "referenceCategory": "PACKAGE-MANAGER",
          "referenceType": "purl",
          "referenceLocator": "pkg:npm/%40scope/pkg@1.0.0"
        }
      ]
    },
    {
      "SPDXID": "SPDXRef-Package-4",
      "name": "legacycorp-sdk",
      "versionInfo": "4.2.0",
      "downloadLocation": "NOASSERTION",
      "filesAnalyzed": false,
      "licenseConcluded": "NOASSERTION",
      "licenseDeclared": "LegacyCorp Proprietary",
      "copyrightText": "NOASSERTION",
      "externalRefs": [
        {
          "referenceCategory": "PACKAGE-MANAGER",
          "referenceType": "purl",
          "referenceLocator": "pkg:npm/legacycorp-sdk@4.2.0"
        }
      ]
    },
    {
      "SPDXID": "SPDXRef-Package-5",
      "name": "Newtonsoft.Json",
      "versionInfo": "13.0.3",
      "downloadLocation": "NOASSERTION",
      "filesAnalyzed": false,
      "licenseConcluded": "NOASSERTION",
      "licenseDeclared": "NOASSERTION",
      "copyrightText": "NOASSERTION",
      "externalRefs": [
        {
          "referenceCategory": "PACKAGE-MANAGER",
          "referenceType": "purl",
          "referenceLocator": "pkg:nuget/Newtonsoft.Json@13.0.3"
        }
      ]
    },
    {
      "SPDXID": "SPDXRef-Package-6",
      "name": "certifi",
      "versionInfo": "2024.2.2",
      "downloadLocation": "NOASSERTION",
      "filesAnalyzed": false,
      "licenseConcluded": "MPL-2.0",
      "licenseDeclared": "NOASSERTION",
      "copyrightText": "NOASSERTION",
      "externalRefs": [
        {
          "referenceCategory": "PACKAGE-MANAGER",
          "referenceType": "purl",
          "referenceLocator": "pkg:pypi/certifi@2024.2.2"
        }
      ]
    },
    {
      "SPDXID": "SPDXRef-Package-7",
      "name": "evidence-pkg",
      "versionInfo": "1.0.0",
      "downloadLocation": "NOASSERTION",
      "filesAnalyzed": false,
      "licenseConcluded": "MIT",
      "licenseDeclared": "NOASSERTION",
      "copyrightText": "Copyright 2024 Evidence Authors",
      "externalRefs": [
        {
          "referenceCategory": "PACKAGE-MANAGER",
          "referenceType": "purl",
          "referenceLocator": "pkg:pypi/evidence-pkg@1.0.0"
        }
      ]
    },
    {
      "SPDXID": "SPDXRef-Package-8",
      "name": "requests",
      "versionInfo": "2.31.0",
      "downloadLocation": "NOASSERTION",
      "filesAnalyzed": false,
      "licenseConcluded": "Apache-2.0",
      "licenseDeclared": "Apache License 2.0",
      "copyrightText": "Copyright 2013 Kenneth Reitz",
      "externalRefs": [
        {
          "referenceCategory": "PACKAGE-MANAGER",
          "referenceType": "purl",
          "referenceLocator": "pkg:pypi/requests@2.31.0"
        }
      ]
    },
    {
      "SPDXID": "SPDXRef-Package-9",
      "name": "requests",
      "versionInfo": "2.31.0",
      "downloadLocation": "NOASSERTION",
      "filesAnalyzed": false,
      "licenseConcluded": "Apache-2.0",
      "licenseDeclared": "Apache License 2.0",
      "copyrightText": "Copyright 2013 Kenneth Reitz",
      "externalRefs": [
        {
          "referenceCategory": "PACKAGE-MANAGER",
          "referenceType": "purl",
          "referenceLocator": "pkg:pypi/requests@2.31.0"
        }
      ]
    },
    {
      "SPDXID": "SPDXRef-Package-10",
      "name": "urllib3",
      "versionInfo": "2.2.1",
      "downloadLocation": "NOASSERTION",
      "filesAnalyzed": false,
      "licenseConcluded": "MIT",
      "licenseDeclared": "MIT License",
      "copyrightText": "NOASSERTION",
      "externalRefs": [
        {
          "referenceCategory": "PACKAGE-MANAGER",
          "referenceType": "purl",
          "referenceLocator": "pkg:pypi/urllib3@2.2.1"
        }
      ]
    },
    {
      "SPDXID": "SPDXRef-Package-11",
      "name": "openssl-libs",
      "versionInfo": "3.0.7-24",
      "downloadLocation": "NOASSERTION",
      "filesAnalyzed": false,
      "licenseConcluded": "NOASSERTION",
      "licenseDeclared": "NOASSERTION",
      "copyrightText": "NOASSERTION",
      "externalRefs": [
        {
          "referenceCategory": "PACKAGE-MANAGER",
          "referenceType": "purl",
          "referenceLocator": "pkg:rpm/openssl-libs@3.0.7-24"
        }
      ]
    }
  ],
  "relationships": [
    {
      "spdxElementId": "SPDXRef-DOCUMENT",
      "relationshipType": "DESCRIBES",
      "relatedSpdxElement": "SPDXRef-Package-0"
    },
    {
      "spdxElementId": "SPDXRef-DOCUMENT",
      "relationshipType": "DESCRIBES",
      "relatedSpdxElement": "SPDXRef-Package-1"
    },
    {
      "spdxElementId": "SPDXRef-DOCUMENT",
      "relationshipType": "DESCRIBES",
      "relatedSpdxElement": "SPDXRef-Package-2"
    },
    {
      "spdxElementId": "SPDXRef-DOCUMENT",
      "relationshipType": "DESCRIBES",
      "relatedSpdxElement": "SPDXRef-Package-3"
    },
    {
      "spdxElementId": "SPDXRef-DOCUMENT",
      "relationshipType": "DESCRIBES",
      "relatedSpdxElement": "SPDXRef-Package-4"
    },
    {
      "spdxElementId": "SPDXRef-DOCUMENT",
      "relationshipType": "DESCRIBES",
      "relatedSpdxElement": "SPDXRef-Package-5"
    },
    {
      "spdxElementId": "SPDXRef-DOCUMENT",
      "relationshipType": "DESCRIBES",
      "relatedSpdxElement": "SPDXRef-Package-6"
    },
    {
      "spdxElementId": "SPDXRef-DOCUMENT",
      "relationshipType": "DESCRIBES",
      "relatedSpdxElement": "SPDXRef-Package-7"
    },
    {
      "spdxElementId": "SPDXRef-DOCUMENT",
      "relationshipType": "DESCRIBES",
      "relatedSpdxElement": "SPDXRef-Package-8"
    },
    {
      "spdxElementId": "SPDXRef-DOCUMENT",
      "relationshipType": "DESCRIBES",
      "relatedSpdxElement": "SPDXRef-Package-9"
    },
    {
      "spdxElementId": "SPDXRef-DOCUMENT",
      "relationshipType": "DESCRIBES",
      "relatedSpdxElement": "SPDXRef-Package-10"
    },
    {
      "spdxElementId": "SPDXRef-DOCUMENT",
      "relationshipType": "DESCRIBES",
      "relatedSpdxElement": "SPDXRef-Package-11"
    },
    {
      "spdxElementId": "SPDXRef-Package-8",
      "relationshipType": "DEPENDS_ON",
      "relatedSpdxElement": "SPDXRef-Package-10"
    },
    {
      "spdxElementId": "SPDXRef-Package-8",
      "relationshipType": "DEPENDS_ON",
      "relatedSpdxElement": "SPDXRef-Package-6"
    }
  ]
}